{
  "schema": "cpb-forge-readiness-attestation-v1",
  "provider": "github",
  "repository": "owner/repository",
  "target_branch": "integration",
  "checked_at": "2026-01-01T00:00:00Z",
  "expires_at": "2026-01-02T00:00:00Z",
  "adapter_version": "cpb-forge-adapter-v1",
  "requirements_digest": "0000000000000000000000000000000000000000000000000000000000000000",
  "overall": "unverified",
  "facts": [
    {
      "id": "protected-target",
      "status": "unverified",
      "summary": "Target protection has not been queried.",
      "evidence": ""
    }
  ],
  "visibility_limits": ["Template only; no live provider query performed."]
}